"DESCRIPTION","DURATION IN MS","NAME","PARENT SUITE","START TIME","STATUS","STOP TIME","SUB SUITE","SUITE","TEST CLASS","TEST METHOD"
" Получение списка всех ID бронирований","1387","Get all booking ids","","Tue Jun 10 18:28:19 UTC 2025","passed","Tue Jun 10 18:28:20 UTC 2025","","Restful booker Api testing","",""
"Полное обновление бронирования","85","Partial update created booking","","Tue Jun 10 18:28:19 UTC 2025","passed","Tue Jun 10 18:28:19 UTC 2025","","Restful booker Api testing","",""
"Полное обновление бронирования","86","Update created booking","","Tue Jun 10 18:28:19 UTC 2025","passed","Tue Jun 10 18:28:19 UTC 2025","","Restful booker Api testing","",""
"Получение бронирования","83","Get created booking","","Tue Jun 10 18:28:18 UTC 2025","passed","Tue Jun 10 18:28:18 UTC 2025","","Restful booker Api testing","",""
" Удаление бронирования","72","Delete created booking by auth user","","Tue Jun 10 18:28:20 UTC 2025","passed","Tue Jun 10 18:28:20 UTC 2025","","Restful booker Api testing","",""
"","209","Authorize valid and invalid login/password pairs","","Tue Jun 10 18:28:18 UTC 2025","passed","Tue Jun 10 18:28:18 UTC 2025","","Restful booker Api testing","",""
"Создание нового бронирования с валидными данными","111","Create booking","","Tue Jun 10 18:28:18 UTC 2025","passed","Tue Jun 10 18:28:18 UTC 2025","","Restful booker Api testing","",""
