"DESCRIPTION","DURATION IN MS","NAME","PARENT SUITE","START TIME","STATUS","STOP TIME","SUB SUITE","SUITE","TEST CLASS","TEST METHOD"
"Полное обновление бронирования","60","Update created booking","","Fri May 23 18:25:54 UTC 2025","passed","Fri May 23 18:25:54 UTC 2025","","Restful booker Api testing","",""
"Создание нового бронирования с валидными данными","82","Create booking","","Fri May 23 18:25:54 UTC 2025","passed","Fri May 23 18:25:54 UTC 2025","","Restful booker Api testing","",""
"","124","Authorize valid and invalid login/password pairs","","Fri May 23 18:25:53 UTC 2025","passed","Fri May 23 18:25:53 UTC 2025","","Restful booker Api testing","",""
"Получение бронирования","60","Get created booking","","Fri May 23 18:25:54 UTC 2025","passed","Fri May 23 18:25:54 UTC 2025","","Restful booker Api testing","",""
"Полное обновление бронирования","82","Partial update created booking","","Fri May 23 18:25:54 UTC 2025","passed","Fri May 23 18:25:54 UTC 2025","","Restful booker Api testing","",""
" Получение списка всех ID бронирований","212","Get all booking ids","","Fri May 23 18:25:54 UTC 2025","passed","Fri May 23 18:25:54 UTC 2025","","Restful booker Api testing","",""
" Удаление бронирования","46","Delete created booking by auth user","","Fri May 23 18:25:54 UTC 2025","passed","Fri May 23 18:25:54 UTC 2025","","Restful booker Api testing","",""
