"DESCRIPTION","DURATION IN MS","NAME","PARENT SUITE","START TIME","STATUS","STOP TIME","SUB SUITE","SUITE","TEST CLASS","TEST METHOD"
" Получение списка всех ID бронирований","341","Get all booking ids","","Sat Jun 14 18:24:32 UTC 2025","passed","Sat Jun 14 18:24:33 UTC 2025","","Restful booker Api testing","",""
"Создание нового бронирования с валидными данными","85","Create booking","","Sat Jun 14 18:24:32 UTC 2025","passed","Sat Jun 14 18:24:32 UTC 2025","","Restful booker Api testing","",""
"Полное обновление бронирования","55","Partial update created booking","","Sat Jun 14 18:24:32 UTC 2025","passed","Sat Jun 14 18:24:32 UTC 2025","","Restful booker Api testing","",""
"Полное обновление бронирования","58","Update created booking","","Sat Jun 14 18:24:32 UTC 2025","passed","Sat Jun 14 18:24:32 UTC 2025","","Restful booker Api testing","",""
"Получение бронирования","55","Get created booking","","Sat Jun 14 18:24:32 UTC 2025","passed","Sat Jun 14 18:24:32 UTC 2025","","Restful booker Api testing","",""
" Удаление бронирования","45","Delete created booking by auth user","","Sat Jun 14 18:24:33 UTC 2025","passed","Sat Jun 14 18:24:33 UTC 2025","","Restful booker Api testing","",""
"","122","Authorize valid and invalid login/password pairs","","Sat Jun 14 18:24:32 UTC 2025","passed","Sat Jun 14 18:24:32 UTC 2025","","Restful booker Api testing","",""
