"DESCRIPTION","DURATION IN MS","NAME","PARENT SUITE","START TIME","STATUS","STOP TIME","SUB SUITE","SUITE","TEST CLASS","TEST METHOD"
" Удаление бронирования","37","Delete created booking by auth user","","Thu May 29 18:27:33 UTC 2025","passed","Thu May 29 18:27:33 UTC 2025","","Restful booker Api testing","",""
"Полное обновление бронирования","48","Update created booking","","Thu May 29 18:27:33 UTC 2025","passed","Thu May 29 18:27:33 UTC 2025","","Restful booker Api testing","",""
"","78","Authorize valid and invalid login/password pairs","","Thu May 29 18:27:32 UTC 2025","passed","Thu May 29 18:27:32 UTC 2025","","Restful booker Api testing","",""
"Полное обновление бронирования","47","Partial update created booking","","Thu May 29 18:27:33 UTC 2025","passed","Thu May 29 18:27:33 UTC 2025","","Restful booker Api testing","",""
" Получение списка всех ID бронирований","239","Get all booking ids","","Thu May 29 18:27:33 UTC 2025","passed","Thu May 29 18:27:33 UTC 2025","","Restful booker Api testing","",""
"Создание нового бронирования с валидными данными","79","Create booking","","Thu May 29 18:27:32 UTC 2025","passed","Thu May 29 18:27:32 UTC 2025","","Restful booker Api testing","",""
"Получение бронирования","48","Get created booking","","Thu May 29 18:27:32 UTC 2025","passed","Thu May 29 18:27:33 UTC 2025","","Restful booker Api testing","",""
