"DESCRIPTION","DURATION IN MS","NAME","PARENT SUITE","START TIME","STATUS","STOP TIME","SUB SUITE","SUITE","TEST CLASS","TEST METHOD"
"Получение бронирования","46","Get created booking","","Fri May 30 18:27:23 UTC 2025","passed","Fri May 30 18:27:23 UTC 2025","","Restful booker Api testing","",""
"Полное обновление бронирования","48","Update created booking","","Fri May 30 18:27:23 UTC 2025","passed","Fri May 30 18:27:23 UTC 2025","","Restful booker Api testing","",""
"Создание нового бронирования с валидными данными","97","Create booking","","Fri May 30 18:27:23 UTC 2025","passed","Fri May 30 18:27:23 UTC 2025","","Restful booker Api testing","",""
" Удаление бронирования","35","Delete created booking by auth user","","Fri May 30 18:27:24 UTC 2025","passed","Fri May 30 18:27:24 UTC 2025","","Restful booker Api testing","",""
"Полное обновление бронирования","49","Partial update created booking","","Fri May 30 18:27:23 UTC 2025","passed","Fri May 30 18:27:23 UTC 2025","","Restful booker Api testing","",""
"","80","Authorize valid and invalid login/password pairs","","Fri May 30 18:27:23 UTC 2025","passed","Fri May 30 18:27:23 UTC 2025","","Restful booker Api testing","",""
" Получение списка всех ID бронирований","235","Get all booking ids","","Fri May 30 18:27:23 UTC 2025","passed","Fri May 30 18:27:24 UTC 2025","","Restful booker Api testing","",""
