"DESCRIPTION","DURATION IN MS","NAME","PARENT SUITE","START TIME","STATUS","STOP TIME","SUB SUITE","SUITE","TEST CLASS","TEST METHOD"
" Удаление бронирования","86","Delete created booking by auth user","","Tue May 13 08:54:47 UTC 2025","passed","Tue May 13 08:54:47 UTC 2025","","Restful booker Api testing","",""
"Полное обновление бронирования","100","Partial update created booking","","Tue May 13 08:54:47 UTC 2025","passed","Tue May 13 08:54:47 UTC 2025","","Restful booker Api testing","",""
" Получение списка всех ID бронирований","283","Get all booking ids","","Tue May 13 08:54:47 UTC 2025","passed","Tue May 13 08:54:47 UTC 2025","","Restful booker Api testing","",""
"","301","Authorize valid and invalid login/password pairs","","Tue May 13 08:54:46 UTC 2025","passed","Tue May 13 08:54:46 UTC 2025","","Restful booker Api testing","",""
"Создание нового бронирования с валидными данными","128","Create booking","","Tue May 13 08:54:46 UTC 2025","passed","Tue May 13 08:54:46 UTC 2025","","Restful booker Api testing","",""
"Получение бронирования","101","Get created booking","","Tue May 13 08:54:46 UTC 2025","passed","Tue May 13 08:54:46 UTC 2025","","Restful booker Api testing","",""
"Полное обновление бронирования","102","Update created booking","","Tue May 13 08:54:46 UTC 2025","passed","Tue May 13 08:54:47 UTC 2025","","Restful booker Api testing","",""
