"DESCRIPTION","DURATION IN MS","NAME","PARENT SUITE","START TIME","STATUS","STOP TIME","SUB SUITE","SUITE","TEST CLASS","TEST METHOD"
"Получение бронирования","44","Get created booking","","Tue May 20 18:28:37 UTC 2025","passed","Tue May 20 18:28:37 UTC 2025","","Restful booker Api testing","",""
"Создание нового бронирования с валидными данными","76","Create booking","","Tue May 20 18:28:37 UTC 2025","passed","Tue May 20 18:28:37 UTC 2025","","Restful booker Api testing","",""
" Удаление бронирования","34","Delete created booking by auth user","","Tue May 20 18:28:38 UTC 2025","passed","Tue May 20 18:28:38 UTC 2025","","Restful booker Api testing","",""
"","71","Authorize valid and invalid login/password pairs","","Tue May 20 18:28:37 UTC 2025","passed","Tue May 20 18:28:37 UTC 2025","","Restful booker Api testing","",""
"Полное обновление бронирования","46","Update created booking","","Tue May 20 18:28:37 UTC 2025","passed","Tue May 20 18:28:38 UTC 2025","","Restful booker Api testing","",""
"Полное обновление бронирования","43","Partial update created booking","","Tue May 20 18:28:38 UTC 2025","passed","Tue May 20 18:28:38 UTC 2025","","Restful booker Api testing","",""
" Получение списка всех ID бронирований","305","Get all booking ids","","Tue May 20 18:28:38 UTC 2025","passed","Tue May 20 18:28:38 UTC 2025","","Restful booker Api testing","",""
