"DESCRIPTION","DURATION IN MS","NAME","PARENT SUITE","START TIME","STATUS","STOP TIME","SUB SUITE","SUITE","TEST CLASS","TEST METHOD"
"Получение бронирования","45","Get created booking","","Sun Jun 01 18:25:35 UTC 2025","passed","Sun Jun 01 18:25:35 UTC 2025","","Restful booker Api testing","",""
"Полное обновление бронирования","46","Update created booking","","Sun Jun 01 18:25:35 UTC 2025","passed","Sun Jun 01 18:25:35 UTC 2025","","Restful booker Api testing","",""
" Получение списка всех ID бронирований","175","Get all booking ids","","Sun Jun 01 18:25:35 UTC 2025","passed","Sun Jun 01 18:25:36 UTC 2025","","Restful booker Api testing","",""
"Создание нового бронирования с валидными данными","74","Create booking","","Sun Jun 01 18:25:35 UTC 2025","passed","Sun Jun 01 18:25:35 UTC 2025","","Restful booker Api testing","",""
"Полное обновление бронирования","44","Partial update created booking","","Sun Jun 01 18:25:35 UTC 2025","passed","Sun Jun 01 18:25:35 UTC 2025","","Restful booker Api testing","",""
" Удаление бронирования","37","Delete created booking by auth user","","Sun Jun 01 18:25:36 UTC 2025","passed","Sun Jun 01 18:25:36 UTC 2025","","Restful booker Api testing","",""
"","87","Authorize valid and invalid login/password pairs","","Sun Jun 01 18:25:35 UTC 2025","passed","Sun Jun 01 18:25:35 UTC 2025","","Restful booker Api testing","",""
